{
  "apiVersion": 1,
  "pluginId": "com.mygamesanywhere.source.steam",
  "name": "Steam Source",
  "version": "0.1.0",
  "entry": "dist/index.js",
  "capabilities": [
    "source.scan",
    "source.launch"
  ],
  "permissions": {
    "processLaunch": true,
    "localFsScopes": [
      "C:/Program Files (x86)/Steam",
      "C:/Program Files/Steam"
    ]
  },
  "configSchema": {
    "type": "object",
    "properties": {},
    "additionalProperties": false
  }
}
